{
  "OwnerAccountId": "example-3286",
  "OwnerDirectoryId": "example-2796",
  "ShareMethod": "example-1832",
  "SharedAccountId": "example-1504",
  "SharedDirectoryId": "example-8178",
  "ShareStatus": "example-2535",
  "ShareNotes": "example-6090",
  "CreatedDateTime": "example-1960",
  "LastUpdatedDateTime": "example-7599"
}